{
  "$schema": "urn:atlas:schema:canonical:taxonomy:v1",
  "taxonomy_version": "1.1.0",
  "status": "accepted",
  "source": "ADR-0003, ADR-0008, ADR-0015, ADR-0016, ADR-0017, ADR-0018, ADR-0019 (Accepted 25 Oct 2026); DEC-050, DEC-070; 1.1.0: owner decision U-1 at Gate G2 (25 Oct 2026)",
  "versioning": {
    "scheme": "semver",
    "minor": "adds types, relationship types, pairs, enumeration values, optional attributes, providers, namespaces, mappings",
    "major": "removes or renames anything, narrows a rule, or makes an attribute required; needs a data migration plan and owner approval",
    "identity_rule": "entity and relationship IDs never change across taxonomy versions; every version row records the taxonomy version it was validated against"
  },
  "enumerations": {
    "lifecycles": [
      "active",
      "deprecated",
      "retired"
    ],
    "record_states": [
      "present",
      "removed",
      "merged"
    ],
    "environment_scopes": [
      "single",
      "shared",
      "unknown"
    ],
    "environment_kinds": [
      "dev",
      "sit",
      "test",
      "uat",
      "preprod",
      "prod",
      "dr",
      "sandbox",
      "other"
    ],
    "deployment_roles": [
      "primary",
      "active_secondary",
      "standby",
      "unknown"
    ],
    "evidence_kinds": [
      "provider_configuration",
      "contract",
      "documentation",
      "human_assertion",
      "inferred"
    ],
    "trust_states": [
      "discovered",
      "documented",
      "curated",
      "inferred",
      "proposed",
      "stale",
      "conflicted"
    ],
    "verification_states": [
      "unverified",
      "verified"
    ],
    "completeness_states": [
      "present",
      "not_documented",
      "not_applicable",
      "unknown_coverage"
    ],
    "match_methods": [
      "provider_id",
      "approved_alias",
      "org_key",
      "steward"
    ],
    "change_set_kinds": [
      "fixture_load",
      "import",
      "steward_edit",
      "merge",
      "split",
      "discovery_sync",
      "migration",
      "revert"
    ],
    "channels": [
      "fixture_cli",
      "import",
      "api",
      "connector",
      "migration",
      "system_job"
    ],
    "actor_kinds": [
      "human",
      "service",
      "system"
    ],
    "fact_kinds": [
      "entity",
      "relationship"
    ]
  },
  "common_attributes": {
    "all": [
      "display_name",
      "lifecycle"
    ],
    "physical": [
      "provider",
      "native_type"
    ],
    "platform_required_for_providers": [
      "private_cloud",
      "on_premises",
      "other"
    ],
    "attribute_name_pattern": "^[a-z][a-z0-9_]*$",
    "forbidden_attribute_name_pattern": "(password|passwd|secret|token|connection_?string|private_?key|access_?key|credential)"
  },
  "providers": [
    {
      "provider": "azure",
      "display_name": "Microsoft Azure",
      "provider_kind": "public_cloud",
      "requires_platform": false,
      "note": "first implementation target"
    },
    {
      "provider": "aws",
      "display_name": "Amazon Web Services",
      "provider_kind": "public_cloud",
      "requires_platform": false
    },
    {
      "provider": "gcp",
      "display_name": "Google Cloud",
      "provider_kind": "public_cloud",
      "requires_platform": false
    },
    {
      "provider": "alibaba",
      "display_name": "Alibaba Cloud",
      "provider_kind": "public_cloud",
      "requires_platform": false
    },
    {
      "provider": "oci",
      "display_name": "Oracle Cloud Infrastructure",
      "provider_kind": "public_cloud",
      "requires_platform": false
    },
    {
      "provider": "huawei",
      "display_name": "Huawei Cloud",
      "provider_kind": "public_cloud",
      "requires_platform": false
    },
    {
      "provider": "tencent",
      "display_name": "Tencent Cloud",
      "provider_kind": "public_cloud",
      "requires_platform": false
    },
    {
      "provider": "ibm",
      "display_name": "IBM Cloud",
      "provider_kind": "public_cloud",
      "requires_platform": false
    },
    {
      "provider": "private_cloud",
      "display_name": "Private cloud",
      "provider_kind": "private_cloud",
      "requires_platform": true
    },
    {
      "provider": "on_premises",
      "display_name": "On-premises infrastructure",
      "provider_kind": "on_premises",
      "requires_platform": true
    },
    {
      "provider": "other",
      "display_name": "Custom or other technology",
      "provider_kind": "other",
      "requires_platform": true
    }
  ],
  "categories": [
    {
      "category": "scope",
      "kind": "physical",
      "description": "Provider account and resource hierarchy"
    },
    {
      "category": "container_cluster",
      "kind": "physical",
      "description": "Container orchestration cluster"
    },
    {
      "category": "container_namespace",
      "kind": "physical",
      "description": "Namespace inside a cluster"
    },
    {
      "category": "runtime_workload",
      "kind": "physical",
      "description": "Deployed runtime unit: container workload, web app, function, service process"
    },
    {
      "category": "compute_host",
      "kind": "physical",
      "description": "Virtual machine, instance or physical host"
    },
    {
      "category": "api_gateway",
      "kind": "physical",
      "description": "API gateway instance"
    },
    {
      "category": "api_endpoint",
      "kind": "physical",
      "description": "An API published on a gateway or platform"
    },
    {
      "category": "messaging_broker",
      "kind": "physical",
      "description": "Broker or messaging namespace"
    },
    {
      "category": "messaging_channel",
      "kind": "physical",
      "description": "Queue, topic or stream"
    },
    {
      "category": "database_server",
      "kind": "physical",
      "description": "Database server or instance hosting databases"
    },
    {
      "category": "data_store",
      "kind": "physical",
      "description": "Database, bucket, file share or cache holding data"
    },
    {
      "category": "secret_store",
      "kind": "physical",
      "description": "Secret or key store"
    },
    {
      "category": "network",
      "kind": "physical",
      "description": "Virtual network"
    },
    {
      "category": "subnet",
      "kind": "physical",
      "description": "Subdivision of a virtual network"
    },
    {
      "category": "generic",
      "kind": "physical",
      "description": "Not yet categorized"
    }
  ],
  "entity_types": [
    {
      "type_key": "core.capability",
      "kind": "logical",
      "category": "core.capability",
      "provider": null,
      "environment_scope": "none",
      "required_attributes": [],
      "attribute_enums": {},
      "identity_namespaces": [
        "org.key"
      ],
      "containment_parents": [
        "core.capability"
      ],
      "self_nesting": true
    },
    {
      "type_key": "core.business_domain",
      "kind": "logical",
      "category": "core.business_domain",
      "provider": null,
      "environment_scope": "none",
      "required_attributes": [],
      "attribute_enums": {},
      "identity_namespaces": [
        "org.key"
      ],
      "containment_parents": [
        "core.business_domain"
      ],
      "self_nesting": true
    },
    {
      "type_key": "core.team",
      "kind": "logical",
      "category": "core.team",
      "provider": null,
      "environment_scope": "none",
      "required_attributes": [],
      "attribute_enums": {},
      "identity_namespaces": [
        "org.key"
      ],
      "containment_parents": [],
      "self_nesting": false
    },
    {
      "type_key": "core.system",
      "kind": "logical",
      "category": "core.system",
      "provider": null,
      "environment_scope": "none",
      "required_attributes": [],
      "attribute_enums": {},
      "identity_namespaces": [
        "org.key"
      ],
      "containment_parents": [],
      "self_nesting": false,
      "description": "Business system made of applications (MOD-01)"
    },
    {
      "type_key": "core.application",
      "kind": "logical",
      "category": "core.application",
      "provider": null,
      "environment_scope": "none",
      "required_attributes": [
        "org_key"
      ],
      "attribute_enums": {},
      "identity_namespaces": [
        "org.key"
      ],
      "containment_parents": [],
      "self_nesting": false
    },
    {
      "type_key": "core.service",
      "kind": "logical",
      "category": "core.service",
      "provider": null,
      "environment_scope": "none",
      "required_attributes": [],
      "attribute_enums": {},
      "identity_namespaces": [
        "org.key"
      ],
      "containment_parents": [
        "core.application"
      ],
      "self_nesting": false,
      "description": "Logical service; C4 container"
    },
    {
      "type_key": "core.component",
      "kind": "logical",
      "category": "core.component",
      "provider": null,
      "environment_scope": "none",
      "required_attributes": [],
      "attribute_enums": {},
      "identity_namespaces": [
        "org.key"
      ],
      "containment_parents": [
        "core.service"
      ],
      "self_nesting": false,
      "description": "C4 component (MOD-01)"
    },
    {
      "type_key": "core.api",
      "kind": "logical",
      "category": "core.api",
      "provider": null,
      "environment_scope": "none",
      "required_attributes": [
        "api_version"
      ],
      "attribute_enums": {},
      "identity_namespaces": [
        "org.key"
      ],
      "containment_parents": [],
      "self_nesting": false,
      "description": "Logical API (DEP-01)"
    },
    {
      "type_key": "core.api_operation",
      "kind": "logical",
      "category": "core.api_operation",
      "provider": null,
      "environment_scope": "none",
      "required_attributes": [
        "http_method",